{
  "$schema": "../_schema/project-data.schema.json",
  "version": "1.0",
  "tasks": [
    {
      "id": "flooring-prep",
      "name": "Flooring Prep & Subfloor",
      "start": "2026-01-02",
      "end": "2026-01-03",
      "progress": 100,
      "assignee": "vendor:precision-flooring",
      "status": "completed",
      "priority": "high",
      "category": "rough-in",
      "description": "Level subfloor, install underlayment, prep for LVP installation",
      "estimatedCost": 800,
      "location": "entire kitchen"
    },
    {
      "id": "flooring-install",
      "name": "LVP Flooring Installation",
      "start": "2026-01-06",
      "end": "2026-01-08",
      "progress": 100,
      "dependencies": ["flooring-prep"],
      "assignee": "vendor:precision-flooring",
      "status": "completed",
      "priority": "high",
      "category": "finish",
      "description": "Install luxury vinyl plank flooring throughout kitchen",
      "estimatedCost": 3200,
      "location": "entire kitchen"
    },
    {
      "id": "drywall-repair",
      "name": "Drywall Repair & Finishing",
      "start": "2026-01-09",
      "end": "2026-01-13",
      "progress": 100,
      "dependencies": ["flooring-install"],
      "assignee": "vendor:coastal-drywall",
      "status": "completed",
      "priority": "normal",
      "category": "finish",
      "description": "Patch holes from demo, tape, mud, and sand to level 4 finish",
      "estimatedCost": 1800,
      "location": "all walls and ceiling"
    },
    {
      "id": "paint-prime",
      "name": "Primer & Paint - Walls",
      "start": "2026-01-14",
      "end": "2026-01-16",
      "progress": 80,
      "dependencies": ["drywall-repair"],
      "assignee": "vendor:island-painters",
      "status": "in_progress",
      "priority": "normal",
      "category": "finish",
      "description": "Prime all surfaces, 2 coats Benjamin Moore Simply White on walls",
      "estimatedCost": 2400,
      "location": "all walls"
    },
    {
      "id": "paint-ceiling",
      "name": "Ceiling Paint",
      "start": "2026-01-14",
      "end": "2026-01-15",
      "progress": 100,
      "dependencies": ["drywall-repair"],
      "assignee": "vendor:island-painters",
      "status": "completed",
      "priority": "normal",
      "category": "finish",
      "description": "Flat white ceiling paint, 2 coats",
      "estimatedCost": 600
    },
    {
      "id": "electrical-rough",
      "name": "Electrical Rough-In Updates",
      "start": "2026-01-09",
      "end": "2026-01-10",
      "progress": 100,
      "dependencies": ["flooring-install"],
      "assignee": "vendor:dare-electric",
      "status": "completed",
      "priority": "high",
      "category": "electrical",
      "description": "Add circuits for island, update panel, run low voltage for undercab lights",
      "estimatedCost": 2800
    },
    {
      "id": "cabinet-install",
      "name": "Cabinet Installation",
      "start": "2026-01-17",
      "end": "2026-01-21",
      "progress": 40,
      "dependencies": ["paint-prime", "electrical-rough"],
      "assignee": "vendor:obx-cabinets",
      "status": "in_progress",
      "priority": "critical",
      "category": "fixtures",
      "description": "Install base and wall cabinets, island cabinet base",
      "estimatedCost": 12000,
      "location": "perimeter and island"
    },
    {
      "id": "countertop-template",
      "name": "Countertop Templating",
      "start": "2026-01-22",
      "end": "2026-01-22",
      "progress": 0,
      "dependencies": ["cabinet-install"],
      "assignee": "vendor:granite-gallery",
      "status": "scheduled",
      "priority": "high",
      "category": "fixtures",
      "description": "Laser template for quartz countertops",
      "estimatedCost": 0
    },
    {
      "id": "trim-door-casing",
      "name": "Door & Window Casing",
      "start": "2026-01-23",
      "end": "2026-01-24",
      "progress": 0,
      "dependencies": ["cabinet-install"],
      "assignee": "vendor:manteo-trim",
      "status": "scheduled",
      "priority": "normal",
      "category": "finish",
      "description": "Install craftsman-style door and window casings",
      "estimatedCost": 1200
    },
    {
      "id": "trim-baseboard",
      "name": "Baseboard & Shoe Molding",
      "start": "2026-01-27",
      "end": "2026-01-28",
      "progress": 0,
      "dependencies": ["trim-door-casing"],
      "assignee": "vendor:manteo-trim",
      "status": "pending",
      "priority": "normal",
      "category": "finish",
      "description": "5.25\" baseboard with quarter-round shoe molding",
      "estimatedCost": 900
    },
    {
      "id": "trim-crown",
      "name": "Crown Molding",
      "start": "2026-01-28",
      "end": "2026-01-29",
      "progress": 0,
      "dependencies": ["trim-door-casing"],
      "assignee": "vendor:manteo-trim",
      "status": "pending",
      "priority": "low",
      "category": "finish",
      "description": "3.5\" crown molding to match rest of house",
      "estimatedCost": 1100
    },
    {
      "id": "countertop-install",
      "name": "Countertop Installation",
      "start": "2026-01-29",
      "end": "2026-01-30",
      "progress": 0,
      "dependencies": ["countertop-template", "trim-baseboard"],
      "assignee": "vendor:granite-gallery",
      "status": "pending",
      "priority": "critical",
      "category": "fixtures",
      "description": "Install Cambria quartz countertops with undermount sink cutout",
      "estimatedCost": 6500,
      "location": "perimeter and island"
    },
    {
      "id": "plumbing-finish",
      "name": "Plumbing Trim & Fixtures",
      "start": "2026-01-30",
      "end": "2026-01-31",
      "progress": 0,
      "dependencies": ["countertop-install"],
      "assignee": "vendor:obx-plumbing",
      "status": "pending",
      "priority": "high",
      "category": "plumbing",
      "description": "Install sink, faucet, disposal, dishwasher connection",
      "estimatedCost": 1800
    },
    {
      "id": "electrical-trim",
      "name": "Electrical Trim & Fixtures",
      "start": "2026-01-30",
      "end": "2026-02-02",
      "progress": 0,
      "dependencies": ["countertop-install", "trim-crown"],
      "assignee": "vendor:dare-electric",
      "status": "pending",
      "priority": "high",
      "category": "electrical",
      "description": "Install outlets, switches, undercab lighting, pendant lights",
      "estimatedCost": 2200
    },
    {
      "id": "backsplash",
      "name": "Tile Backsplash",
      "start": "2026-02-02",
      "end": "2026-02-03",
      "progress": 0,
      "dependencies": ["countertop-install", "electrical-trim"],
      "assignee": "vendor:coastal-tile",
      "status": "pending",
      "priority": "normal",
      "category": "finish",
      "description": "Subway tile backsplash with contrasting grout",
      "estimatedCost": 1600
    },
    {
      "id": "appliance-install",
      "name": "Appliance Installation",
      "start": "2026-02-03",
      "end": "2026-02-04",
      "progress": 0,
      "dependencies": ["plumbing-finish", "electrical-trim"],
      "assignee": "vendor:best-buy-install",
      "status": "pending",
      "priority": "high",
      "category": "fixtures",
      "description": "Install range, refrigerator, dishwasher, microwave",
      "estimatedCost": 500
    },
    {
      "id": "touch-up-punch",
      "name": "Touch-up & Punch List",
      "start": "2026-02-04",
      "end": "2026-02-05",
      "progress": 0,
      "dependencies": ["backsplash", "appliance-install"],
      "assignee": "vendor:island-painters",
      "status": "pending",
      "priority": "normal",
      "category": "cleanup",
      "description": "Paint touch-ups, caulking, final adjustments",
      "estimatedCost": 400
    },
    {
      "id": "final-clean",
      "name": "Final Cleaning",
      "start": "2026-02-05",
      "end": "2026-02-05",
      "progress": 0,
      "dependencies": ["touch-up-punch"],
      "assignee": "vendor:sparkle-clean",
      "status": "pending",
      "priority": "normal",
      "category": "cleanup",
      "description": "Post-construction deep cleaning",
      "estimatedCost": 350
    }
  ],
  "vendors": [
    {
      "id": "precision-flooring",
      "name": "Precision Flooring OBX",
      "type": "specialty-contractor",
      "trade": "flooring",
      "contact": {
        "name": "Mike Torres",
        "phone": "252-555-0101",
        "email": "mike@precisionflooring.com",
        "address": {
          "city": "Kill Devil Hills",
          "state": "NC",
          "zip": "27948"
        }
      },
      "license": {
        "number": "FL-12345",
        "state": "NC",
        "expiration": "2026-06-30"
      },
      "insurance": {
        "liability": true,
        "workersComp": true
      },
      "rating": 5,
      "status": "preferred",
      "paymentTerms": "net-30"
    },
    {
      "id": "coastal-drywall",
      "name": "Coastal Drywall Services",
      "type": "subcontractor",
      "trade": "drywall",
      "contact": {
        "name": "James Walker",
        "phone": "252-555-0102",
        "email": "james@coastaldrywall.com"
      },
      "rating": 4,
      "status": "active",
      "paymentTerms": "draws"
    },
    {
      "id": "island-painters",
      "name": "Island Painters Inc",
      "type": "specialty-contractor",
      "trade": "painting",
      "contact": {
        "name": "Sarah Chen",
        "phone": "252-555-0103",
        "email": "sarah@islandpainters.com"
      },
      "license": {
        "number": "PT-67890",
        "state": "NC"
      },
      "insurance": {
        "liability": true,
        "workersComp": true
      },
      "rating": 5,
      "status": "preferred",
      "paymentTerms": "net-15"
    },
    {
      "id": "dare-electric",
      "name": "Dare County Electric",
      "type": "subcontractor",
      "trade": "electrical",
      "contact": {
        "name": "Robert Johnson",